{
  "kicker": "다음 단계",
  "title": "확정 사항과 다음 6주",
  "decision": {
    "label": "결정 사항",
    "headline": "세로 숏폼 포맷 승격",
    "points": [
      "오프닝 9초·클로징 12초 규격 확정",
      "재심의 v2 조건부 항목 전건 해소",
      "가로 포맷 회귀 무손상 실측 확인"
    ],
    "meta": "2026-07-29 심의 확정"
  },
  "steps": [
    {
      "when": "8월 1주",
      "owner": "렌더팀",
      "what": "숏폼 무대 캡처 파이프라인 이관"
    },
    {
      "when": "8월 2주",
      "owner": "심의운영",
      "what": "포맷 승격 심의 소집 · 사용 로그 2건"
    },
    {
      "when": "8월 4주",
      "owner": "카피팀",
      "what": "클로징 3종 카피 자수 가이드 확정"
    },
    {
      "when": "9월 1주",
      "owner": "TD",
      "what": "레지스트리 병합 후 게이트 전수"
    }
  ],
  "note": {
    "pre": "미해소 액션아이템 ",
    "strong": "0건",
    "post": " — 회의록 §5 참조"
  },
  "frame": {
    "brand": "HWAX 협업진단",
    "idx": "07",
    "total": "07"
  }
}
