{
  "kicker": "다음 단계",
  "title": "확정과 다음 3주",
  "decision": {
    "headline": "숏폼 포맷 파일럿 승격",
    "points": [
      "가로 포맷 회귀 무손상 확인"
    ]
  },
  "steps": [
    {
      "when": "8월 1주",
      "owner": "렌더팀",
      "what": "숏폼 무대 캡처 이관"
    },
    {
      "when": "8월 2주",
      "owner": "심의운영",
      "what": "포맷 승격 심의 소집"
    },
    {
      "when": "8월 3주",
      "owner": "TD",
      "what": "회귀 게이트 전수 재실행"
    }
  ]
}
