{
  "kicker": "다음 단계와 인수인계",
  "title": "확정 사항과 다음 열두 주 실행 일정",
  "decision": {
    "label": "의결 확정",
    "headline": "세로 숏폼 포맷 정식 승격",
    "points": [
      "오프닝 9초·클로징 12초 규격을 모두 확정한다",
      "재심의 v2 조건부 항목 일곱 건을 모두 해소",
      "가로 포맷 회귀는 무손상으로 실측 확인되었음"
    ],
    "meta": "2026-07-29 만장일치 확정"
  },
  "steps": [
    {
      "when": "8월 1~2주",
      "owner": "렌더링 파트장",
      "what": "숏폼 무대 캡처 파이프라인 이관 및 회귀 재확인"
    },
    {
      "when": "8월 3~4주",
      "owner": "심의운영 총괄",
      "what": "포맷 승격 심의 소집과 사용 로그 두 건 제출"
    },
    {
      "when": "9월 1~2주",
      "owner": "카피라이팅팀",
      "what": "클로징 세 종의 카피 자수 가이드 확정과 배포"
    },
    {
      "when": "9월 3~4주",
      "owner": "기술총괄 TD",
      "what": "레지스트리 병합 후 게이트 일곱 종 전수 재실행"
    }
  ],
  "note": {
    "pre": "이번 회차 미해소 액션아이템은 ",
    "strong": "0건 · 전건 해소",
    "post": " — 상세는 회의록 §5 참조"
  },
  "frame": {
    "brand": "HWAX 협업진단 플랫폼",
    "idx": "12",
    "total": "12"
  }
}
